"EID","ContributorName","CatCodeIndustry","CatCodeGroup","CatCodeBusiness","PerDem","PerRep","DemCol","RepCol","Total"
"8692","RHODE ISLAND ASSOCIATION OF REALTORS","Real Estate","Finance, Insurance & Real Estate","Real estate",84.2845326716294,15.7154673283706,"#0000ADAF","#0000ADAF",6045
"27744897","RI TROOPERS ASSOCIATION","Uncoded","Uncoded","Uncoded",94.1176470588235,5.88235294117647,"#0000E0AF","#0000E0AF",8500
"28206811","RI PUBLIC EMPLOYEES EDUCATION","Uncoded","Uncoded","Uncoded",100,0,"#0000FFAF","#0000FFAF",2910
"19357","RHODE ISLAND STATE FRATERNAL ORDER OF POLICE","Public Sector Unions","Labor","Police & fire fighters unions and associations",100,0,"#0000FFAF","#0000FFAF",3575
"904","EMILYS LIST","Abortion Policy","Ideology/Single Issue","Abortion policy, pro-choice",100,0,"#0000FFAF","#0000FFAF",1500
"20889","FOOD & COMMERCIAL WORKERS LOCAL 328","General Trade Unions","Labor","Retail trade unions",100,0,"#0000FFAF","#0000FFAF",8075
"9556897","CRANSTON TEACHERS ALLIANCE","Public Sector Unions","Labor","Teachers unions",100,0,"#0000FFAF","#0000FFAF",2125
"19713","ELECTRICAL WORKERS LOCAL 99","General Trade Unions","Labor","Electrical workers/IBEW",96.0648148148148,3.93518518518519,"#0000EBAF","#0000EBAF",4320
"8714","RHODE ISLAND TRIAL LAWYERS ASSOCIATION","Lawyers & Lobbyists","Lawyers & Lobbyists","Attorneys & law firms",100,0,"#0000FFAF","#0000FFAF",2900
"1854","NATIONAL RIFLE ASSOCIATION","Gun Control","Ideology/Single Issue","Anti-gun control",93.6054421768708,6.39455782312925,"#0000DBAF","#0000DBAF",7350
"2566","INTERNATIONAL BROTHERHOOD OF TEAMSTERS / IBT","Transportation Unions","Labor","Teamsters unions",100,0,"#0000FFAF","#0000FFAF",3620
"8694","RHODE ISLAND BROTHERHOOD OF CORRECTIONAL OFFICERS","Public Sector Unions","Labor","Police & fire fighters unions and associations",93.9393939393939,6.06060606060606,"#0000DBAF","#0000DBAF",10725
"8709","RHODE ISLAND SOCIETY OF CPAS","Accountants","Finance, Insurance & Real Estate","Accountants",100,0,"#0000FFAF","#0000FFAF",1525
"17314","PROVIDENCE CHAMBER OF COMMERCE","Business Associations","General Business","Chambers of commerce",90.5405405405405,4.05405405405405,"#0000CCAF","#0000E5AF",3700
"19345","FRATERNAL ORDER OF POLICE PROVIDENCE LODGE 3","Public Sector Unions","Labor","Police & fire fighters unions and associations",100,0,"#0000FFAF","#0000FFAF",3335
"20105","RHODE ISLAND LABORERS DISTRICT COUNCIL","General Trade Unions","Labor","Construction unions",98.5915492957747,1.40845070422535,"#0000F5AF","#0000F5AF",10650
"3467722","AMALGAMATED TRANSIT UNION / ATU","Transportation Unions","Labor","Transportation unions",95,5,"#0000E5AF","#0000E5AF",5000
"19527","RHODE ISLAND STATE ASSOCIATION OF FIRE FIGHTERS","Public Sector Unions","Labor","Police & fire fighters unions and associations",100,0,"#0000FFAF","#0000FFAF",3600
"20166","RHODE ISLAND AFL-CIO","General Trade Unions","Labor","Labor unions",100,0,"#0000FFAF","#0000FFAF",8060
"8705","RHODE ISLAND MEDICAL SOCIETY","Health Professionals","Health","Physicians",95.8018471872376,4.19815281276238,"#0000E5AF","#0000E5AF",5955
"20599","PLUMBERS & PIPEFITTERS LOCAL 51","General Trade Unions","Labor","Construction unions",94.0209267563528,5.97907324364723,"#0000E0AF","#0000E0AF",3345
"15496","RHODE ISLAND DENTAL ASSOCIATION","Health Professionals","Health","Dentists",82.5,17.5,"#0000A3AF","#0000A3AF",4000
"20248","NATIONAL EDUCATION ASSOCIATION RHODE ISLAND","Public Sector Unions","Labor","Teachers unions",97.4874371859297,2.51256281407035,"#0000F0AF","#0000F0AF",7960
"2692","UNITED HEALTHCARE SERVICES","Insurance","Finance, Insurance & Real Estate","Accident & health insurance",89.4736842105263,10.5263157894737,"#0000C7AF","#0000C7AF",1425
"7118","HOSPITAL ASSOCIATION OF RHODE ISLAND","Hospitals & Nursing Homes","Health","Hospitals",100,0,"#0000FFAF","#0000FFAF",1575
"7174","INDEPENDENT INSURANCE AGENTS OF RHODE ISLAND","Insurance","Finance, Insurance & Real Estate","Insurance agencies, brokers & agents",100,0,"#0000FFAF","#0000FFAF",1650
"8691","RHODE ISLAND ASSOCIATION OF INSURANCE & FINANCIAL ADVISORS","Insurance","Finance, Insurance & Real Estate","Insurance companies, general",100,0,"#0000FFAF","#0000FFAF",1050
"19060","RHODE ISLAND MORTGAGE BANKERS ASSOCIATION","Real Estate","Finance, Insurance & Real Estate","Mortgage bankers & brokers",85.7142857142857,14.2857142857143,"#0000B3AF","#0000B3AF",1750
"19246","RHODE ISLAND FEDERATION OF TEACHERS & HEALTH PROFESSIONALS","Public Sector Unions","Labor","Teachers unions",100,0,"#0000FFAF","#0000FFAF",3395
"20943","STEELWORKERS DISTRICT 4","Uncoded","Uncoded","Uncoded",100,0,"#0000FFAF","#0000FFAF",850
"19245","PROVIDENCE TEACHERS UNION","Public Sector Unions","Labor","Teachers unions",100,0,"#0000FFAF","#0000FFAF",2020
"18844","PLANNED PARENTHOOD OF SOUTHERN NEW ENGLAND","Health Services","Health","Health care services",89.3805309734513,10.6194690265487,"#0000C7AF","#0000C7AF",2825
"21500","RHODE ISLAND CHAPTER NATIONAL ASSOCIATION OF SOCIAL WORKERS","Welfare/Social Work","Government Agencies/Education/Other","Welfare & social work",100,0,"#0000FFAF","#0000FFAF",2250
"9568921","SMITHFIELD REPUBLICAN TOWN CMTE","Party Committees","Party","Republican Party committees",0,100,"#FF0000AF","#FF0000AF",1000
"8176","NEWPORT GRAND JAI ALAI","Gambling & Casinos","General Business","Casinos, racetracks & gambling",89.8305084745763,10.1694915254237,"#0000C7AF","#0000C7AF",2950
"19122","RHODE ISLAND AFSCME COUNCIL 94","Public Sector Unions","Labor","State & local government employee unions",100,0,"#0000FFAF","#0000FFAF",1700
"8580","PROFESSIONAL & TECHNICAL ENGINEERS LOCAL 400","General Trade Unions","Labor","Other unions",84.2105263157895,15.7894736842105,"#0000ADAF","#0000ADAF",950
"8695","RHODE ISLAND BUILDERS ASSOCIATION","General Contractors","Construction","Builders associations",100,0,"#0000FFAF","#0000FFAF",1000
"10990191","NEW ENGLAND GAS COMPANY","Uncoded","Uncoded","Uncoded",100,0,"#0000FFAF","#0000FFAF",800
"15657035","RHODE ISLAND OPTOMETRIC ASSOCIATION","Uncoded","Uncoded","Uncoded",100,0,"#0000FFAF","#0000FFAF",2000
"19454","CRANSTON FIRE FIGHTERS LOCAL 1363","Public Sector Unions","Labor","Police & fire fighters unions and associations",100,0,"#0000FFAF","#0000FFAF",900
"18931","RHODE ISLAND HEALTH CARE ASSOCIATION","Hospitals & Nursing Homes","Health","Nursing homes",100,0,"#0000FFAF","#0000FFAF",825
"9567770","BLUE CROSS BLUE SHIELD OF RHODE ISLAND","Insurance","Finance, Insurance & Real Estate","Accident & health insurance",100,0,"#0000FFAF","#0000FFAF",4965
"5770","AMICA MUTUAL INSURANCE","Insurance","Finance, Insurance & Real Estate","Property & casualty insurance",100,0,"#0000FFAF","#0000FFAF",1300
"741","CVS CAREMARK","Retail Sales","General Business","Drug stores",100,0,"#0000FFAF","#0000FFAF",1300
"8393","PARTRIDGE SNOW & HAHN","Lawyers & Lobbyists","Lawyers & Lobbyists","Attorneys & law firms",100,0,"#0000FFAF","#0000FFAF",510
"8701","RHODE ISLAND GREYHOUND OWNERS ASSOCIATION","Gambling & Casinos","General Business","Casinos, racetracks & gambling",100,0,"#0000FFAF","#0000FFAF",800
"9206","TILLINGHAST LICHT PERKINS SMITH & COHEN","Lawyers & Lobbyists","Lawyers & Lobbyists","Attorneys & law firms",100,0,"#0000FFAF","#0000FFAF",3050
"9553311","CONSTRUCTION INDUSTRIES OF RHODE ISLAND","General Contractors","Construction","Builders associations",100,0,"#0000FFAF","#0000FFAF",600
"9561686","POLICE OFFICERS LOCAL 404","Public Sector Unions","Labor","Police & fire fighters unions and associations",100,0,"#0000FFAF","#0000FFAF",600
"9594837","FIRE CHIEFS","Public Sector Unions","Labor","Police & fire fighters unions and associations",100,0,"#0000FFAF","#0000FFAF",1050
"9620560","BRICKLAYERS & ALLIED CRAFTWORKERS LOCAL 1 RHODE ISLAND","General Trade Unions","Labor","Construction unions",100,0,"#0000FFAF","#0000FFAF",600
"9634470","FLEET CIVIC AFFAIRS CMTE","Commercial Banks","Finance, Insurance & Real Estate","Commercial banks & bank holding companies",100,0,"#0000FFAF","#0000FFAF",650
"9564281","NORTH KINGSTOWN REPUBLICAN TOWN CMTE","Party Committees","Party","Republican Party committees",0,100,"#FF0000AF","#FF0000AF",620
"9633288","HOPE FUND","Uncoded","Uncoded","Uncoded",0,93.4782608695652,"#FF0000AF","#E00000AF",4600
"19916","OPERATING ENGINEERS LOCAL 57","General Trade Unions","Labor","Construction unions",100,0,"#0000FFAF","#0000FFAF",850
"9573611","WOONSOCKET FIRE FIGHTERS LOCAL 732","Public Sector Unions","Labor","Police & fire fighters unions and associations",100,0,"#0000FFAF","#0000FFAF",700
"264684","NEW ENGLAND CONVENIENCE STORE ASSOCIATION","Oil & Gas","Energy & Natural Resources","Gasoline service stations",100,0,"#0000FFAF","#0000FFAF",875
"9558956","DD PROVIDER PAC (DEMOCRACY DATA)","Uncoded","Uncoded","Uncoded",100,0,"#0000FFAF","#0000FFAF",400
"9568809","OIL HEAT INSTITUTE","Oil & Gas","Energy & Natural Resources","Fuel oil dealers",100,0,"#0000FFAF","#0000FFAF",1000
"9635936","RHODE ISLAND DEPUTY SHERIFFS LOCAL 2409","Public Sector Unions","Labor","Police & fire fighters unions and associations",100,0,"#0000FFAF","#0000FFAF",1000
"9560172","RHODE ISLAND MD EYE PAC","Health Professionals","Health","Optometrists & ophthalmologists",82.3529411764706,17.6470588235294,"#0000A3AF","#0000A3AF",850
"19260","WEST WARWICK TEACHERS ALLIANCE LOCAL 1017","Public Sector Unions","Labor","Teachers unions",100,0,"#0000FFAF","#0000FFAF",700
"6973","GREATER WOONSOCKET LABOR COUNCIL","General Trade Unions","Labor","Labor unions",100,0,"#0000FFAF","#0000FFAF",850
"9556899","LINCOLN TEACHERS ASSOCIATION","Public Sector Unions","Labor","Teachers unions",66.6666666666667,33.3333333333333,"#000052AF","#000052AF",600
"9546705","UNITED NURSES & ALLIED PROFESSIONALS","General Trade Unions","Labor","Health worker unions",100,0,"#0000FFAF","#0000FFAF",400
"8597","PROVIDENCE RHODE ISLAND CENTRAL FEDERATED COUNCIL","General Trade Unions","Labor","Labor unions",100,0,"#0000FFAF","#0000FFAF",500
"19397","IRONWORKERS LOCAL 37","General Trade Unions","Labor","Construction unions",100,0,"#0000FFAF","#0000FFAF",825
"8700","RHODE ISLAND FOOD DEALERS ASSOCIATION","Food Processing & Sales","Agriculture","Food & kindred products manufacturing",100,0,"#0000FFAF","#0000FFAF",325
"8703","RHODE ISLAND HOSPITALITY & TOURISM ASSOCIATION","Lodging & Tourism","General Business","Lodging & tourism",100,0,"#0000FFAF","#0000FFAF",675
"17312","NORTHERN RHODE ISLAND CHAMBER OF COMMERCE","Business Associations","General Business","Chambers of commerce",100,0,"#0000FFAF","#0000FFAF",525
"19526","PROVIDENCE FIRE FIGHTERS LOCAL 799","Public Sector Unions","Labor","Police & fire fighters unions and associations",100,0,"#0000FFAF","#0000FFAF",625
"9554598","RHODE ISLAND ALLIANCE SOCIAL SERVICES EMPLOYEES LOCAL 580","Uncoded","Uncoded","Uncoded",100,0,"#0000FFAF","#0000FFAF",325
"9618954","RHODE ISLAND EMPLOYMENT SECURITY ALLIANCE LOCAL 401","Public Sector Unions","Labor","State & local government employee unions",100,0,"#0000FFAF","#0000FFAF",475
"9638911","DEBLOIS POLITICAL ACTION FUND","Oil & Gas","Energy & Natural Resources","Gasoline service stations",100,0,"#0000FFAF","#0000FFAF",325
"27621738","RI STATE NURSES ASSOCIATION","Uncoded","Uncoded","Uncoded",100,0,"#0000FFAF","#0000FFAF",350
"9553318","RHODE ISLAND MARINE TRADE ASSOCIATION","Sea Transport","Transportation","Sea transport",100,0,"#0000FFAF","#0000FFAF",475
"27621780","RI GREYHOUND OWNERS ASSOCIATION","Uncoded","Uncoded","Uncoded",100,0,"#0000FFAF","#0000FFAF",350
"9567929","RHODE ISLAND PODIATRY PAC","Health Professionals","Health","Other physician specialists",100,0,"#0000FFAF","#0000FFAF",220
"40616499","GUN OWNERS","Uncoded","Uncoded","Uncoded",100,0,"#0000FFAF","#0000FFAF",210
